{"expiresAt":"2027-01-01T00:00:00+00:00","id":"urn:uuid:interop-timestamps-1","issuedAt":"2026-01-01T00:00:00.000Z","issuer":"did:key:z6MkvDqGT54cXesYGvABpF1UapVNwjCqRcafi4Px6Thv5T3Z","payload":{"entry":{"role":"admin","subject":"did:web:alice.example"}},"proof":{"created":"2026-09-16T10:34:46Z","cryptosuite":"eddsa-jcs-2022","proofPurpose":"authentication","proofValue":"z5CgKz8iNSEzw48icKbWTSwzokMBX8289FTzXK1goVRY9g3XhnKkwCw5vowdFhokHA55Nig7M8frFFekqxfgaFggN","type":"DataIntegrityProof","verificationMethod":"did:key:z6MkvDqGT54cXesYGvABpF1UapVNwjCqRcafi4Px6Thv5T3Z#z6MkvDqGT54cXesYGvABpF1UapVNwjCqRcafi4Px6Thv5T3Z"},"recipient":"did:web:maintainer.example","type":"https://trusttasks.org/spec/acl/grant/0.1"}
