{"id":"urn:uuid:interop-1","issuedAt":"2026-01-01T00:00:00Z","issuer":"did:key:z6MkvDqGT54cXesYGvABpF1UapVNwjCqRcafi4Px6Thv5T3Z","payload":{"entry":{"role":"admin","subject":"did:web:alice.example"}},"proof":{"created":"2026-09-16T10:34:46Z","cryptosuite":"eddsa-jcs-2022","proofPurpose":"assertionMethod","proofValue":"zbBjAshSrFcq3jaNSykHWRSmzNgGPU9DsPYFar8mLy2183ZfUtKTyz8B1nN6WnBdWEkXjT3MiYJvMnHsT1aEMrCK","type":"DataIntegrityProof","verificationMethod":"did:key:z6MkvDqGT54cXesYGvABpF1UapVNwjCqRcafi4Px6Thv5T3Z#z6MkvDqGT54cXesYGvABpF1UapVNwjCqRcafi4Px6Thv5T3Z"},"recipient":"did:web:maintainer.example","type":"https://trusttasks.org/spec/acl/grant/0.1"}
