{"id":"urn:uuid:interop-ecdsa-ts-p256","issuedAt":"2026-01-01T00:00:00Z","issuer":"did:key:zDnaeh9fox4L179iZvDpaLBvDw7uVcvVoccUFy5CnLGvpc3uW","payload":{"entry":{"role":"admin","subject":"did:web:alice.example"}},"recipient":"did:web:maintainer.example","type":"https://trusttasks.org/spec/acl/grant/0.1","proof":{"type":"DataIntegrityProof","cryptosuite":"ecdsa-jcs-2019","created":"2026-10-22T00:00:00Z","verificationMethod":"did:key:zDnaeh9fox4L179iZvDpaLBvDw7uVcvVoccUFy5CnLGvpc3uW#zDnaeh9fox4L179iZvDpaLBvDw7uVcvVoccUFy5CnLGvpc3uW","proofPurpose":"assertionMethod","proofValue":"z3xbMR2hsqSc2T3MAyGCoknwXjCAmNHehNxXANF7mnTtQDMQVWY7xNjhYA3Zg6zwgaT2gyKV2i7S1bLpU4CioqRgx"}}
