{"id":"urn:uuid:interop-ecdsa-go-p256","issuedAt":"2026-01-01T00:00:00Z","issuer":"did:key:zDnaeh9fox4L179iZvDpaLBvDw7uVcvVoccUFy5CnLGvpc3uW","payload":{"entry":{"role":"admin","subject":"did:web:alice.example"}},"proof":{"created":"2026-10-22T00:00:00Z","cryptosuite":"ecdsa-jcs-2019","proofPurpose":"assertionMethod","proofValue":"z4TD3XoghFLfxbCSyDLJyetb89VgeidjscSBB3u99ouuZrHiPwfk5S2uCgMeaFPELc2aKTZUHWL3VBmZ8y4PYmbo3","type":"DataIntegrityProof","verificationMethod":"did:key:zDnaeh9fox4L179iZvDpaLBvDw7uVcvVoccUFy5CnLGvpc3uW#zDnaeh9fox4L179iZvDpaLBvDw7uVcvVoccUFy5CnLGvpc3uW"},"recipient":"did:web:maintainer.example","type":"https://trusttasks.org/spec/acl/grant/0.1"}
