{"id":"urn:uuid:interop-ecdsa-go-p384","issuedAt":"2026-01-01T00:00:00Z","issuer":"did:key:z82LkuYfVGJ6owv4a3wpCnjKDi6wcpoWb5mbxB3UwBUzo37q6Bd5XLWE37v2VDYu4SfPEpB","payload":{"entry":{"role":"admin","subject":"did:web:alice.example"}},"proof":{"created":"2026-10-22T00:00:00Z","cryptosuite":"ecdsa-jcs-2019","proofPurpose":"assertionMethod","proofValue":"zZyjHu4w8w9VGs3fcDszF6GR3dWYVfWx1GzeM6fpsyr5h488FcfK9XXLGDncUzgLJ4HPTJxeUey5MsqtfJVDCcqpbd2AsA3v9dpxRbUg8AH3btYyPvZ5cMME2TBuQiGF49av","type":"DataIntegrityProof","verificationMethod":"did:key:z82LkuYfVGJ6owv4a3wpCnjKDi6wcpoWb5mbxB3UwBUzo37q6Bd5XLWE37v2VDYu4SfPEpB#z82LkuYfVGJ6owv4a3wpCnjKDi6wcpoWb5mbxB3UwBUzo37q6Bd5XLWE37v2VDYu4SfPEpB"},"recipient":"did:web:maintainer.example","type":"https://trusttasks.org/spec/acl/grant/0.1"}
