{"id":"urn:uuid:interop-ecdsa-ts-p384","issuedAt":"2026-01-01T00:00:00Z","issuer":"did:key:z82LkuYfVGJ6owv4a3wpCnjKDi6wcpoWb5mbxB3UwBUzo37q6Bd5XLWE37v2VDYu4SfPEpB","payload":{"entry":{"role":"admin","subject":"did:web:alice.example"}},"recipient":"did:web:maintainer.example","type":"https://trusttasks.org/spec/acl/grant/0.1","proof":{"type":"DataIntegrityProof","cryptosuite":"ecdsa-jcs-2019","created":"2026-10-22T00:00:00Z","verificationMethod":"did:key:z82LkuYfVGJ6owv4a3wpCnjKDi6wcpoWb5mbxB3UwBUzo37q6Bd5XLWE37v2VDYu4SfPEpB#z82LkuYfVGJ6owv4a3wpCnjKDi6wcpoWb5mbxB3UwBUzo37q6Bd5XLWE37v2VDYu4SfPEpB","proofPurpose":"assertionMethod","proofValue":"zFAqNijGZGhJQkBhBABqM2oQSGKYJsg3RVNXVGVtUE7yJ8UTkxrPbidfqZVqVyz8pLW7p4SA2o8Stap7upgbbqjSwMpR9tTgoDSSjBPmEk6n2xTFvJVhBtDh6rcyJLQriZjx"}}
